{
  "schema": "scholarium.education-plugin-gate5.v1",
  "plugin_id": "scholarium-source",
  "version": "0.1.0",
  "stateless": true,
  "memory_model": "central_gateway_only",
  "allowed_callers": [
    "Codex/OpenAI",
    "Antigravity/Gemini"
  ],
  "entry_skill": "skills/scholarium-source/SKILL.md",
  "permissions": [
    "central_gateway.submit",
    "central_gateway.read_own_receipt"
  ],
  "prohibited": [
    "plugin_local_memory",
    "raw_student_tokens",
    "unsourced_claims",
    "generative_rag_answer"
  ],
  "required_contracts": [
    "scholarium.central-knowledge-gateway.v1",
    "synthia.education.source-card.v1"
  ],
  "integrity": {
    "algorithm": "sha256",
    "files": [
      {
        "path": "AGENTS.md",
        "sha256": "c24add8459f9619184c6d895afed33797ed4dcaee88ec060703ffdd02b15aefe"
      },
      {
        "path": "SOUL.md",
        "sha256": "fec4cca1d70ca05e92ea458ea60b69af4c02ba51c0c75631276dd320f2fbb308"
      },
      {
        "path": "USER.md",
        "sha256": "a8768656449a8978e1b6527eca9460dfdac06f9a56f75ab9dff7c98001df4eab"
      },
      {
        "path": ".codex-plugin/plugin.json",
        "sha256": "bced142450574f746ce21df2049ee1414d2c19e09aace2ae4da9afa3a8875675"
      },
      {
        "path": "skills/scholarium-source/SKILL.md",
        "sha256": "58dd1cc368e78050978fac899afad14f3f109fb90f517f807ecafcaeca72f477"
      }
    ]
  }
}
